{
  "study_id": "CXR1032",
  "image_id": "CXR1032_IM-0026-1001-0002",
  "view": "Frontal",
  "findings": [
    {
      "finding": "Atelectasis",
      "status": "possible",
      "model_score": 0.5019,
      "location": "unspecified",
      "severity": "unspecified",
      "evidence_sources": [
        "vision_model"
      ]
    },
    {
      "finding": "Infiltration",
      "status": "possible",
      "model_score": 0.2822,
      "location": "unspecified",
      "severity": "unspecified",
      "evidence_sources": [
        "vision_model"
      ]
    },
    {
      "finding": "Fibrosis",
      "status": "possible",
      "model_score": 0.2544,
      "location": "unspecified",
      "severity": "unspecified",
      "evidence_sources": [
        "vision_model"
      ]
    },
    {
      "finding": "Consolidation",
      "status": "possible",
      "model_score": 0.1473,
      "location": "unspecified",
      "severity": "unspecified",
      "evidence_sources": [
        "vision_model"
      ]
    },
    {
      "finding": "Pneumothorax",
      "status": "possible",
      "model_score": 0.0479,
      "location": "unspecified",
      "severity": "unspecified",
      "evidence_sources": [
        "vision_model"
      ]
    },
    {
      "finding": "Cardiomegaly",
      "status": "possible",
      "model_score": 0.0455,
      "location": "unspecified",
      "severity": "unspecified",
      "evidence_sources": [
        "vision_model"
      ]
    },
    {
      "finding": "Effusion",
      "status": "possible",
      "model_score": 0.0258,
      "location": "unspecified",
      "severity": "unspecified",
      "evidence_sources": [
        "vision_model"
      ]
    }
  ],
  "llm_input_package": {
    "task": "radiology_report_generation",
    "study": {
      "study_id": "CXR1032",
      "image_id": "CXR1032_IM-0026-1001-0002",
      "view": "Frontal"
    },
    "evidence": [
      {
        "finding": "Atelectasis",
        "status": "possible",
        "model_score": 0.5019,
        "location": "unspecified",
        "severity": "unspecified"
      },
      {
        "finding": "Infiltration",
        "status": "possible",
        "model_score": 0.2822,
        "location": "unspecified",
        "severity": "unspecified"
      },
      {
        "finding": "Fibrosis",
        "status": "possible",
        "model_score": 0.2544,
        "location": "unspecified",
        "severity": "unspecified"
      },
      {
        "finding": "Consolidation",
        "status": "possible",
        "model_score": 0.1473,
        "location": "unspecified",
        "severity": "unspecified"
      },
      {
        "finding": "Pneumothorax",
        "status": "possible",
        "model_score": 0.0479,
        "location": "unspecified",
        "severity": "unspecified"
      },
      {
        "finding": "Cardiomegaly",
        "status": "possible",
        "model_score": 0.0455,
        "location": "unspecified",
        "severity": "unspecified"
      },
      {
        "finding": "Effusion",
        "status": "possible",
        "model_score": 0.0258,
        "location": "unspecified",
        "severity": "unspecified"
      }
    ],
    "constraints": {
      "do_not_invent_findings": true,
      "do_not_invent_location": true,
      "do_not_invent_severity": true,
      "preserve_uncertainty": true
    }
  }
}