{
  "study_id": "CXR1401",
  "image_id": "CXR1401_IM-0256-1002",
  "view": "Frontal",
  "findings": [
    {
      "finding": "Lung Opacity",
      "status": "possible",
      "model_score": 0.6665,
      "location": "unspecified",
      "severity": "unspecified",
      "evidence_sources": [
        "vision_model"
      ]
    },
    {
      "finding": "Infiltration",
      "status": "possible",
      "model_score": 0.5219,
      "location": "unspecified",
      "severity": "unspecified",
      "evidence_sources": [
        "vision_model"
      ]
    },
    {
      "finding": "Mass",
      "status": "possible",
      "model_score": 0.5193,
      "location": "unspecified",
      "severity": "unspecified",
      "evidence_sources": [
        "vision_model"
      ]
    },
    {
      "finding": "Enlarged Cardiomediastinum",
      "status": "possible",
      "model_score": 0.5173,
      "location": "unspecified",
      "severity": "unspecified",
      "evidence_sources": [
        "vision_model"
      ]
    },
    {
      "finding": "Pleural_Thickening",
      "status": "possible",
      "model_score": 0.5145,
      "location": "unspecified",
      "severity": "unspecified",
      "evidence_sources": [
        "vision_model"
      ]
    },
    {
      "finding": "Fibrosis",
      "status": "possible",
      "model_score": 0.509,
      "location": "unspecified",
      "severity": "unspecified",
      "evidence_sources": [
        "vision_model"
      ]
    },
    {
      "finding": "Nodule",
      "status": "possible",
      "model_score": 0.5044,
      "location": "unspecified",
      "severity": "unspecified",
      "evidence_sources": [
        "vision_model"
      ]
    },
    {
      "finding": "Emphysema",
      "status": "possible",
      "model_score": 0.504,
      "location": "unspecified",
      "severity": "unspecified",
      "evidence_sources": [
        "vision_model"
      ]
    },
    {
      "finding": "Fracture",
      "status": "possible",
      "model_score": 0.5019,
      "location": "unspecified",
      "severity": "unspecified",
      "evidence_sources": [
        "vision_model"
      ]
    },
    {
      "finding": "Consolidation",
      "status": "possible",
      "model_score": 0.5018,
      "location": "unspecified",
      "severity": "unspecified",
      "evidence_sources": [
        "vision_model"
      ]
    },
    {
      "finding": "Pneumothorax",
      "status": "possible",
      "model_score": 0.5003,
      "location": "unspecified",
      "severity": "unspecified",
      "evidence_sources": [
        "vision_model"
      ]
    },
    {
      "finding": "Effusion",
      "status": "possible",
      "model_score": 0.2885,
      "location": "unspecified",
      "severity": "unspecified",
      "evidence_sources": [
        "vision_model"
      ]
    },
    {
      "finding": "Cardiomegaly",
      "status": "possible",
      "model_score": 0.1704,
      "location": "unspecified",
      "severity": "unspecified",
      "evidence_sources": [
        "vision_model"
      ]
    }
  ],
  "llm_input_package": {
    "task": "radiology_report_generation",
    "study": {
      "study_id": "CXR1401",
      "image_id": "CXR1401_IM-0256-1002",
      "view": "Frontal"
    },
    "evidence": [
      {
        "finding": "Lung Opacity",
        "status": "possible",
        "model_score": 0.6665,
        "location": "unspecified",
        "severity": "unspecified"
      },
      {
        "finding": "Infiltration",
        "status": "possible",
        "model_score": 0.5219,
        "location": "unspecified",
        "severity": "unspecified"
      },
      {
        "finding": "Mass",
        "status": "possible",
        "model_score": 0.5193,
        "location": "unspecified",
        "severity": "unspecified"
      },
      {
        "finding": "Enlarged Cardiomediastinum",
        "status": "possible",
        "model_score": 0.5173,
        "location": "unspecified",
        "severity": "unspecified"
      },
      {
        "finding": "Pleural_Thickening",
        "status": "possible",
        "model_score": 0.5145,
        "location": "unspecified",
        "severity": "unspecified"
      },
      {
        "finding": "Fibrosis",
        "status": "possible",
        "model_score": 0.509,
        "location": "unspecified",
        "severity": "unspecified"
      },
      {
        "finding": "Nodule",
        "status": "possible",
        "model_score": 0.5044,
        "location": "unspecified",
        "severity": "unspecified"
      },
      {
        "finding": "Emphysema",
        "status": "possible",
        "model_score": 0.504,
        "location": "unspecified",
        "severity": "unspecified"
      },
      {
        "finding": "Fracture",
        "status": "possible",
        "model_score": 0.5019,
        "location": "unspecified",
        "severity": "unspecified"
      },
      {
        "finding": "Consolidation",
        "status": "possible",
        "model_score": 0.5018,
        "location": "unspecified",
        "severity": "unspecified"
      },
      {
        "finding": "Pneumothorax",
        "status": "possible",
        "model_score": 0.5003,
        "location": "unspecified",
        "severity": "unspecified"
      },
      {
        "finding": "Effusion",
        "status": "possible",
        "model_score": 0.2885,
        "location": "unspecified",
        "severity": "unspecified"
      },
      {
        "finding": "Cardiomegaly",
        "status": "possible",
        "model_score": 0.1704,
        "location": "unspecified",
        "severity": "unspecified"
      }
    ],
    "constraints": {
      "do_not_invent_findings": true,
      "do_not_invent_location": true,
      "do_not_invent_severity": true,
      "preserve_uncertainty": true
    }
  }
}