{
  "study_id": "CXR1007",
  "image_id": "CXR1007_IM-0008-1001",
  "view": "Frontal",
  "findings": [
    {
      "finding": "Infiltration",
      "status": "possible",
      "model_score": 0.3772,
      "location": "unspecified",
      "severity": "unspecified",
      "evidence_sources": [
        "vision_model"
      ]
    },
    {
      "finding": "Pleural_Thickening",
      "status": "possible",
      "model_score": 0.2904,
      "location": "unspecified",
      "severity": "unspecified",
      "evidence_sources": [
        "vision_model"
      ]
    },
    {
      "finding": "Fibrosis",
      "status": "possible",
      "model_score": 0.2864,
      "location": "unspecified",
      "severity": "unspecified",
      "evidence_sources": [
        "vision_model"
      ]
    },
    {
      "finding": "Consolidation",
      "status": "possible",
      "model_score": 0.1026,
      "location": "unspecified",
      "severity": "unspecified",
      "evidence_sources": [
        "vision_model"
      ]
    },
    {
      "finding": "Pneumothorax",
      "status": "possible",
      "model_score": 0.0597,
      "location": "unspecified",
      "severity": "unspecified",
      "evidence_sources": [
        "vision_model"
      ]
    },
    {
      "finding": "Effusion",
      "status": "possible",
      "model_score": 0.0088,
      "location": "unspecified",
      "severity": "unspecified",
      "evidence_sources": [
        "vision_model"
      ]
    },
    {
      "finding": "Cardiomegaly",
      "status": "possible",
      "model_score": 0.0029,
      "location": "unspecified",
      "severity": "unspecified",
      "evidence_sources": [
        "vision_model"
      ]
    }
  ],
  "llm_input_package": {
    "task": "radiology_report_generation",
    "study": {
      "study_id": "CXR1007",
      "image_id": "CXR1007_IM-0008-1001",
      "view": "Frontal"
    },
    "evidence": [
      {
        "finding": "Infiltration",
        "status": "possible",
        "model_score": 0.3772,
        "location": "unspecified",
        "severity": "unspecified"
      },
      {
        "finding": "Pleural_Thickening",
        "status": "possible",
        "model_score": 0.2904,
        "location": "unspecified",
        "severity": "unspecified"
      },
      {
        "finding": "Fibrosis",
        "status": "possible",
        "model_score": 0.2864,
        "location": "unspecified",
        "severity": "unspecified"
      },
      {
        "finding": "Consolidation",
        "status": "possible",
        "model_score": 0.1026,
        "location": "unspecified",
        "severity": "unspecified"
      },
      {
        "finding": "Pneumothorax",
        "status": "possible",
        "model_score": 0.0597,
        "location": "unspecified",
        "severity": "unspecified"
      },
      {
        "finding": "Effusion",
        "status": "possible",
        "model_score": 0.0088,
        "location": "unspecified",
        "severity": "unspecified"
      },
      {
        "finding": "Cardiomegaly",
        "status": "possible",
        "model_score": 0.0029,
        "location": "unspecified",
        "severity": "unspecified"
      }
    ],
    "constraints": {
      "do_not_invent_findings": true,
      "do_not_invent_location": true,
      "do_not_invent_severity": true,
      "preserve_uncertainty": true
    }
  }
}