{
  "study_id": "CXR1031",
  "image_id": "CXR1031_IM-0025-4004",
  "view": "Frontal",
  "findings": [
    {
      "finding": "Fibrosis",
      "status": "possible",
      "model_score": 0.5074,
      "location": "unspecified",
      "severity": "unspecified",
      "evidence_sources": [
        "vision_model"
      ]
    },
    {
      "finding": "Cardiomegaly",
      "status": "possible",
      "model_score": 0.5071,
      "location": "unspecified",
      "severity": "unspecified",
      "evidence_sources": [
        "vision_model"
      ]
    },
    {
      "finding": "Emphysema",
      "status": "possible",
      "model_score": 0.5002,
      "location": "unspecified",
      "severity": "unspecified",
      "evidence_sources": [
        "vision_model"
      ]
    },
    {
      "finding": "Atelectasis",
      "status": "possible",
      "model_score": 0.3498,
      "location": "unspecified",
      "severity": "unspecified",
      "evidence_sources": [
        "vision_model"
      ]
    },
    {
      "finding": "Consolidation",
      "status": "possible",
      "model_score": 0.083,
      "location": "unspecified",
      "severity": "unspecified",
      "evidence_sources": [
        "vision_model"
      ]
    },
    {
      "finding": "Effusion",
      "status": "possible",
      "model_score": 0.0622,
      "location": "unspecified",
      "severity": "unspecified",
      "evidence_sources": [
        "vision_model"
      ]
    },
    {
      "finding": "Pneumothorax",
      "status": "possible",
      "model_score": 0.0173,
      "location": "unspecified",
      "severity": "unspecified",
      "evidence_sources": [
        "vision_model"
      ]
    }
  ],
  "llm_input_package": {
    "task": "radiology_report_generation",
    "study": {
      "study_id": "CXR1031",
      "image_id": "CXR1031_IM-0025-4004",
      "view": "Frontal"
    },
    "evidence": [
      {
        "finding": "Fibrosis",
        "status": "possible",
        "model_score": 0.5074,
        "location": "unspecified",
        "severity": "unspecified"
      },
      {
        "finding": "Cardiomegaly",
        "status": "possible",
        "model_score": 0.5071,
        "location": "unspecified",
        "severity": "unspecified"
      },
      {
        "finding": "Emphysema",
        "status": "possible",
        "model_score": 0.5002,
        "location": "unspecified",
        "severity": "unspecified"
      },
      {
        "finding": "Atelectasis",
        "status": "possible",
        "model_score": 0.3498,
        "location": "unspecified",
        "severity": "unspecified"
      },
      {
        "finding": "Consolidation",
        "status": "possible",
        "model_score": 0.083,
        "location": "unspecified",
        "severity": "unspecified"
      },
      {
        "finding": "Effusion",
        "status": "possible",
        "model_score": 0.0622,
        "location": "unspecified",
        "severity": "unspecified"
      },
      {
        "finding": "Pneumothorax",
        "status": "possible",
        "model_score": 0.0173,
        "location": "unspecified",
        "severity": "unspecified"
      }
    ],
    "constraints": {
      "do_not_invent_findings": true,
      "do_not_invent_location": true,
      "do_not_invent_severity": true,
      "preserve_uncertainty": true
    }
  }
}